Search Query,Source/Medium,Clicks,Impressions,CTR,Average Position
new australian films,google / organic,0,1,0.00%,61
new australian muslim party,google / organic,0,3,0.00%,29
new australian parent visa,google / organic,0,1,0.00%,93
new australian political party,google / organic,0,2,0.00%,42
new australian rules for international students,google / organic,0,1,0.00%,26
new bail act,google / organic,0,6,0.00%,48
new bookmakers july 2018,google / organic,0,5,0.00%,97
new brunswick station,google / organic,0,1,0.00%,96
new build social housing,google / organic,0,1,0.00%,81
new business report,google / organic,0,1,0.00%,32
new caledonia barrier reef,google / organic,0,2,0.00%,48
new caledonia barrier reef map,google / organic,0,2,0.00%,35
new caledonia climate,google / organic,0,8,0.00%,96
new caledonia coral reef,google / organic,0,1,0.00%,77
new caledonia reef,google / organic,0,1,0.00%,68
new caledonia referendum,google / organic,0,1,0.00%,100
new caledonia unesco heritage,google / organic,0,6,0.00%,82
new caledonian barrier reef,google / organic,0,6,0.00%,49
new caledonian barrier reef reefs,google / organic,0,1,0.00%,36
new century,google / organic,0,1,0.00%,96
new century chinese school,google / organic,0,1,0.00%,89
new charter of aged care rights,google / organic,0,65,0.00%,10
new charter of residents rights and responsibilities,google / organic,0,1,0.00%,15
new charter of rights,google / organic,0,1,0.00%,16
new charter of rights aged care,google / organic,0,11,0.00%,11
new college of the humanities,google / organic,0,1,0.00%,21
new development in technology,google / organic,0,1,0.00%,51
new developments sydney,google / organic,0,1,0.00%,92
new dimensions,google / organic,0,9,0.00%,88
new directions australia,google / organic,0,3,0.00%,91
new directions housing,google / organic,0,1,0.00%,43
new directions imports,google / organic,0,1,0.00%,38
new directions ipswich,google / organic,0,1,0.00%,30
new directions mothers and babies services,google / organic,0,6,0.00%,8.3
new driver driving at night,google / organic,0,1,0.00%,71
new energy jobs fund,google / organic,0,13,0.00%,29
new energy solar annual report,google / organic,0,1,0.00%,25
new energy technologies,google / organic,0,1,0.00%,80
new film production,google / organic,0,1,0.00%,10
new food products australia,google / organic,0,1,0.00%,72
new frontier energy,google / organic,0,1,0.00%,71
new frontier meaning,google / organic,0,1,0.00%,95
new frontier publishing,google / organic,0,1,0.00%,77
new future coburg,google / organic,0,5,0.00%,44
new futures coburg,google / organic,0,2,0.00%,77
new gas connection adelaide,google / organic,0,1,0.00%,57
new generation preserving,google / organic,0,1,0.00%,79
new green building technology,google / organic,0,1,0.00%,36
new holland publishers submissions,google / organic,0,1,0.00%,98
new housing development in central coast,google / organic,0,1,0.00%,71
new housing developments auckland,google / organic,0,1,0.00%,96
new housing developments in sydney,google / organic,0,15,0.00%,63
new housing developments sydney,google / organic,0,7,0.00%,54
new housing developments western sydney,google / organic,0,6,0.00%,64
new housing estates central coast,google / organic,0,2,0.00%,73
new housing estates ripley valley,google / organic,0,5,0.00%,71
new housing estates sydney,google / organic,0,156,0.00%,67
new housing estates western sydney,google / organic,0,1,0.00%,81
new industries 2018,google / organic,0,1,0.00%,25
new investment plan,google / organic,0,1,0.00%,83
new job seeker,google / organic,0,1,0.00%,91
new land release north west sydney,google / organic,0,2,0.00%,65
new land release sydney,google / organic,0,8,0.00%,93
new land release sydney south west,google / organic,0,101,0.00%,54
new learning environments,google / organic,0,3,0.00%,93
new learning spaces,google / organic,0,6,0.00%,17
new links training,google / organic,0,1,0.00%,65
new matilda,google / organic,0,66,0.00%,7.6
new matilda 2019,google / organic,0,1,0.00%,20
new matilda news,google / organic,0,4,0.00%,7.0
new medical imaging technology,google / organic,0,4,0.00%,92
new medical imaging technology 2017,google / organic,0,3,0.00%,41
new metro stations sydney,google / organic,0,3,0.00%,70
new mobile phones 2011,google / organic,0,1,0.00%,90
new mobility scooter,google / organic,0,1,0.00%,68
new muslim care,google / organic,0,3,0.00%,60
new norcia monks abuse,google / organic,0,1,0.00%,21
new norcia orphanage,google / organic,0,1,0.00%,72
new parent visa,google / organic,0,1,0.00%,92
new parent visa australia,google / organic,0,2,0.00%,88
new pathway for nz citizens in australia,google / organic,0,1,0.00%,81
new progress housing pay rent,google / organic,0,1,0.00%,53
new prostitution laws,google / organic,0,3,0.00%,37
new qualitative research methods,google / organic,0,4,0.00%,41
new residential developments sydney,google / organic,0,12,0.00%,87
new right criminology,google / organic,0,6,0.00%,52
new sci hub domain,google / organic,0,1,0.00%,69
new social housing developments,google / organic,0,2,0.00%,87
new south wales brothels,google / organic,0,3,0.00%,10
new south wales climate,google / organic,0,1,0.00%,56
new south wales crime commission,google / organic,0,6,0.00%,54
new south wales crime statistics,google / organic,0,3,0.00%,10
new south wales economy,google / organic,0,2,0.00%,49
new south wales education standards authority,google / organic,0,2,0.00%,43
new south wales environmental impact assessment survey,google / organic,0,1,0.00%,75
new south wales holiday destinations,google / organic,0,1,0.00%,58
new south wales legislative council,google / organic,0,1,0.00%,53
new south wales ombudsman,google / organic,0,2,0.00%,32
new south wales police news,google / organic,0,1,0.00%,40
new south wales tolls,google / organic,0,1,0.00%,78
new south wales tourism,google / organic,0,1,0.00%,54
new south wales travel,google / organic,0,1,0.00%,83
new south wales treasury,google / organic,0,1,0.00%,59
new standards aged care,google / organic,0,1,0.00%,130
new sustainable technology,google / organic,0,1,0.00%,82
new sydney metro map,google / organic,0,1,0.00%,79
new sydney metro route,google / organic,0,4,0.00%,34
"new technologies are continuously improving and replacing existing products. although technological change is often difficult to predict, suggest how the following companies and products might be affected by the internet and digital technologies: ( a )",google / organic,0,5,0.00%,33
new technology used in training and development,google / organic,0,1,0.00%,68
new tiny homes,google / organic,0,3,0.00%,76
new tiny homes for sale,google / organic,0,1,0.00%,75
new tiny houses for sale,google / organic,0,71,0.00%,63
new train line western sydney,google / organic,0,1,0.00%,62
new train station sydney,google / organic,0,1,0.00%,67
new trends in education of 21st century society,google / organic,0,6,0.00%,54
new urbanism street design,google / organic,0,1,0.00%,58
new visa category for australia,google / organic,0,2,0.00%,95
new water restrictions sydney,google / organic,0,1,0.00%,18
new way training,google / organic,0,2,0.00%,79
new way transport,google / organic,0,1,0.00%,76
new ways of seeing through qualitative research,google / organic,0,1,0.00%,10
new zealand 2017 election,google / organic,0,1,0.00%,28
new zealand age pension,google / organic,0,1,0.00%,73
new zealand age pension eligibility,google / organic,0,3,0.00%,72
new zealand artificial intelligence,google / organic,0,1,0.00%,83
new zealand arts council,google / organic,0,2,0.00%,20
new zealand benefits for permanent residents,google / organic,0,2,0.00%,95
new zealand broadcasting corporation,google / organic,0,2,0.00%,84
new zealand brothels,google / organic,0,4,0.00%,40
new zealand business number,google / organic,0,20,0.00%,22
new zealand carbon price,google / organic,0,1,0.00%,67
new zealand census 2013,google / organic,0,2,0.00%,55
new zealand centre for political research,google / organic,0,3,0.00%,8.7
new zealand climate refugee,google / organic,0,1,0.00%,38
new zealand climate refugee visa,google / organic,0,6,0.00%,53
new zealand climate refugees,google / organic,0,3,0.00%,68
new zealand contemporary china research centre,google / organic,0,3,0.00%,14
new zealand court system,google / organic,0,1,0.00%,83
new zealand crime and victims survey,google / organic,0,3,0.00%,10
new zealand crime rate,google / organic,0,4,0.00%,35
new zealand crime stats,google / organic,0,2,0.00%,20
new zealand economic outlook,google / organic,0,1,0.00%,53
new zealand economic outlook 2017,google / organic,0,1,0.00%,54
new zealand economy facts,google / organic,0,1,0.00%,70
new zealand economy outlook,google / organic,0,1,0.00%,71
new zealand economy type,google / organic,0,1,0.00%,30
new zealand election 2014,google / organic,0,2,0.00%,33
new zealand election 2017,google / organic,0,19,0.00%,40
new zealand election 2017 results,google / organic,0,5,0.00%,26
new zealand election results,google / organic,0,16,0.00%,39
new zealand election results 2017,google / organic,0,11,0.00%,25
new zealand electoral commission,google / organic,0,1,0.00%,67
new zealand electorates,google / organic,0,1,0.00%,25
new zealand embassy brazil,google / organic,0,1,0.00%,80
new zealand emissions trading scheme,google / organic,0,2,0.00%,61
new zealand escort agency,google / organic,0,2,0.00%,39
new zealand exports 2018,google / organic,0,1,0.00%,30
new zealand first party list,google / organic,0,1,0.00%,73
new zealand flag proposals,google / organic,0,1,0.00%,100
new zealand foreign affairs,google / organic,0,1,0.00%,44
new zealand gdp 2018,google / organic,0,3,0.00%,53
new zealand gdp by sector,google / organic,0,1,0.00%,63
new zealand general election,google / organic,0,16,0.00%,62
new zealand general election 2017,google / organic,0,24,0.00%,37
new zealand holidays 2011,google / organic,0,1,0.00%,47
new zealand hungy,google / organic,0,4,0.00%,71
new zealand immunisation,google / organic,0,1,0.00%,63
new zealand imports and exports 2018,google / organic,0,1,0.00%,44
new zealand institute of architects,google / organic,0,1,0.00%,47
new zealand journal of marine and freshwater research abbreviation,google / organic,0,1,0.00%,50
new zealand land mass,google / organic,0,1,0.00%,82
new zealand landscape architecture,google / organic,0,1,0.00%,86
new zealand lottery grants board,google / organic,0,1,0.00%,59
new zealand manufacturing,google / organic,0,2,0.00%,5.0
new zealand mbie,google / organic,0,1,0.00%,38
new zealand ministry of health,google / organic,0,1,0.00%,88
new zealand modern architecture,google / organic,0,3,0.00%,52
new zealand non verbal communication,google / organic,0,3,0.00%,29
new zealand palliative care strategy,google / organic,0,1,0.00%,11
new zealand pension eligibility,google / organic,0,1,0.00%,76
new zealand people's party,google / organic,0,2,0.00%,68
new zealand planning institute,google / organic,0,1,0.00%,89
new zealand prostitute,google / organic,0,3,0.00%,47
new zealand prostitutes,google / organic,0,1,0.00%,80
new zealand prostitution,google / organic,0,9,0.00%,55
new zealand prostitution law,google / organic,0,1,0.00%,23
new zealand prostitution laws,google / organic,0,3,0.00%,64
new zealand public broadcaster,google / organic,0,1,0.00%,46
new zealand race tracks,google / organic,0,4,0.00%,66
new zealand racecourses,google / organic,0,1,0.00%,89
new zealand racing calendar,google / organic,0,11,0.00%,33
new zealand racing conference,google / organic,0,3,0.00%,36
new zealand real gdp,google / organic,0,1,0.00%,49
new zealand scv,google / organic,0,3,0.00%,83
new zealand sectors report 2017,google / organic,0,1,0.00%,91
new zealand sex,google / organic,0,44,0.00%,48
new zealand sex com,google / organic,0,1,0.00%,77
new zealand sex industry,google / organic,0,1,0.00%,68
new zealand sex site,google / organic,0,1,0.00%,18
new zealand sex trade,google / organic,0,1,0.00%,50
new zealand sex work,google / organic,0,1,0.00%,61
new zealand sex work laws,google / organic,0,1,0.00%,48
new zealand sex worker,google / organic,0,1,0.00%,52
new zealand sex workers,google / organic,0,4,0.00%,71
new zealand sex. com,google / organic,0,2,0.00%,22
new zealand special category visa,google / organic,0,3,0.00%,94
new zealand tax file number,google / organic,0,1,0.00%,82
new zealand tertiary education,google / organic,0,1,0.00%,61
new zealand thoroughbred racing,google / organic,0,1,0.00%,41
new zealand tourism bureau,google / organic,0,1,0.00%,70
new zealand tourism india,google / organic,0,1,0.00%,99
new zealand tourism industry,google / organic,0,1,0.00%,43
new zealand tourism report,google / organic,0,2,0.00%,38
new zealand tourism statistics,google / organic,0,8,0.00%,33
new zealand tourism statistics 2015,google / organic,0,1,0.00%,23
new zealand tourism statistics 2017,google / organic,0,2,0.00%,38
new zealand tourism statistics 2018,google / organic,0,1,0.00%,30
new zealand tourist arrivals,google / organic,0,1,0.00%,51
new zealand universities,google / organic,0,1,0.00%,88
new zealand vegetation,google / organic,0,1,0.00%,98
new zealand victims of crime,google / organic,0,1,0.00%,10
new zealand voting system,google / organic,0,22,0.00%,54
new zealand: election act date,google / organic,0,1,0.00%,64
new zealander sex,google / organic,0,1,0.00%,39
newborn upfront payment eligibility,google / organic,0,1,0.00%,100
newcastle 2013,google / organic,0,1,0.00%,73
newcastle airport plan,google / organic,0,1,0.00%,59
newcastle airport public transport,google / organic,0,2,0.00%,86
newcastle airport to newcastle interchange,google / organic,0,5,0.00%,37
newcastle airport to newcastle train station,google / organic,0,7,0.00%,49
newcastle airport to train station,google / organic,0,7,0.00%,62
newcastle airport train station,google / organic,0,3,0.00%,76
newcastle airport transport links,google / organic,0,2,0.00%,38
newcastle australia train station,google / organic,0,1,0.00%,67
newcastle budgerigar auction,google / organic,0,1,0.00%,65
newcastle bus depot,google / organic,0,1,0.00%,73
newcastle bus routes,google / organic,0,1,0.00%,76
newcastle buses on demand,google / organic,0,1,0.00%,35
newcastle caravan parks long term,google / organic,0,4,0.00%,56
newcastle central station redevelopment,google / organic,0,1,0.00%,19
newcastle central station to newcastle airport,google / organic,0,1,0.00%,64
newcastle city council depot,google / organic,0,1,0.00%,52
newcastle city council zoning maps,google / organic,0,4,0.00%,85
newcastle city zone athletics,google / organic,0,1,0.00%,29
newcastle crime statistics,google / organic,0,1,0.00%,26
newcastle department of housing,google / organic,0,1,0.00%,67
newcastle economy,google / organic,0,1,0.00%,75
newcastle electorate federal,google / organic,0,1,0.00%,46
newcastle entertainment precinct,google / organic,0,1,0.00%,87
newcastle federal election results,google / organic,0,1,0.00%,41
newcastle ferry destinations,google / organic,0,1,0.00%,73
newcastle ferry terminal,google / organic,0,1,0.00%,40
newcastle freight,google / organic,0,4,0.00%,78
newcastle halal shop,google / organic,0,1,0.00%,90
newcastle herald archives funeral notices,google / organic,0,1,0.00%,84
newcastle herald circulation,google / organic,0,1,0.00%,90
newcastle herald social pages,google / organic,0,1,0.00%,82
newcastle hunter tourism accommodation centre,google / organic,0,63,0.00%,65
newcastle industrial area,google / organic,0,6,0.00%,47
newcastle interchange,google / organic,0,2,0.00%,82
newcastle interchange parking,google / organic,0,7,0.00%,44
newcastle interchange railway station,google / organic,0,6,0.00%,44
newcastle interchange to maitland,google / organic,0,3,0.00%,32
newcastle interchange to newcastle airport,google / organic,0,4,0.00%,58
newcastle interchange to sydney,google / organic,0,1,0.00%,70
newcastle interchange to thornton,google / organic,0,1,0.00%,14
newcastle interchange train station,google / organic,0,3,0.00%,46
newcastle libraries,google / organic,0,3,0.00%,18
newcastle library,google / organic,0,1,0.00%,46
newcastle library renew,google / organic,0,3,0.00%,28
newcastle light rail extension,google / organic,0,5,0.00%,44
newcastle light rail stage 2,google / organic,0,10,0.00%,38
newcastle light rail times,google / organic,0,1,0.00%,34
newcastle local environmental plan 2012,google / organic,0,2,0.00%,40
newcastle locating services,google / organic,0,1,0.00%,72
newcastle lonely planet,google / organic,0,7,0.00%,93
newcastle long term parking,google / organic,0,1,0.00%,90
newcastle lookouts,google / organic,0,1,0.00%,97
newcastle parking stations,google / organic,0,3,0.00%,59
newcastle petrol prices,google / organic,0,1,0.00%,95
newcastle population growth,google / organic,0,2,0.00%,55
newcastle radar 256,google / organic,0,1,0.00%,65
newcastle radio stations list,google / organic,0,2,0.00%,84
newcastle railway station,google / organic,0,1,0.00%,64
newcastle railway station address,google / organic,0,1,0.00%,42
newcastle railway station nsw,google / organic,0,2,0.00%,65
newcastle railway stations,google / organic,0,2,0.00%,56
newcastle shuttle bus 110 timetable,google / organic,0,1,0.00%,67
newcastle to armidale train,google / organic,0,10,0.00%,49
newcastle to cardiff train,google / organic,0,5,0.00%,74
newcastle to cessnock bus,google / organic,0,3,0.00%,65
newcastle to dubbo bus,google / organic,0,3,0.00%,79
newcastle to maitland train,google / organic,0,1,0.00%,62
newcastle to maitland train timetable,google / organic,0,1,0.00%,70
newcastle to melbourne train,google / organic,0,2,0.00%,88
newcastle to muswellbrook train,google / organic,0,4,0.00%,72
newcastle to port macquarie bus,google / organic,0,9,0.00%,58
newcastle to port macquarie train,google / organic,0,11,0.00%,43
newcastle to raymond terrace bus,google / organic,0,1,0.00%,47
newcastle to singleton train,google / organic,0,7,0.00%,47
newcastle to stockton ferry timetable,google / organic,0,2,0.00%,66
newcastle to sydney express train,google / organic,0,2,0.00%,72
newcastle tourist attractions,google / organic,0,1,0.00%,73
newcastle train station facilities,google / organic,0,1,0.00%,34
newcastle train station nsw,google / organic,0,1,0.00%,57
newcastle train station to newcastle airport,google / organic,0,1,0.00%,53
newcastle transport on demand,google / organic,0,2,0.00%,49
newcastle weather radar 512 km,google / organic,0,1,0.00%,55
newdemocracy foundation,google / organic,0,1,0.00%,95
newly arrived resident's waiting period,google / organic,0,4,0.00%,51
newly licensed driver,google / organic,0,2,0.00%,58
newly licensed driver plate,google / organic,0,6,0.00%,22
newman p,google / organic,0,1,0.00%,5.0
newmans rewinding townsville,google / organic,0,2,0.00%,74
newnem shop online,google / organic,0,4,0.00%,41
newnes pictorial knowledge australian edition,google / organic,0,1,0.00%,69
news and citizen,google / organic,0,2,0.00%,86
news corp australia owner,google / organic,0,1,0.00%,62
news headlines smh,google / organic,0,1,0.00%,65
news journalism,google / organic,0,1,0.00%,50
news values,google / organic,0,2,0.00%,85
news values in journalism,google / organic,0,3,0.00%,76
news values include,google / organic,0,1,0.00%,87
news values journalism,google / organic,0,3,0.00%,77
news values pdf,google / organic,0,2,0.00%,75
newsland sex,google / organic,0,1,0.00%,50
newslettertools,google / organic,0,1,0.00%,59
newspaper advertising costs australia,google / organic,0,1,0.00%,92
newspaper advertising costs melbourne,google / organic,0,1,0.00%,82
newspaper circulation australia,google / organic,0,2,0.00%,81
newspaper readership demographics australia,google / organic,0,1,0.00%,88
newspoll australian,google / organic,0,1,0.00%,39
newstart allowance rent assistance,google / organic,0,1,0.00%,23
newstart job plan,google / organic,0,1,0.00%,94
newstart over 55,google / organic,0,1,0.00%,90
newtown graffiti,google / organic,0,86,0.00%,57
newtown street art,google / organic,0,11,0.00%,74
newtown street art map,google / organic,0,2,0.00%,27
newtown sydney graffiti,google / organic,0,4,0.00%,46
newtown sydney street art,google / organic,0,2,0.00%,84
newzeland sex,google / organic,0,1,0.00%,52
newziland sex,google / organic,0,1,0.00%,46
next century technologies,google / organic,0,3,0.00%,74
next digital,google / organic,0,3,0.00%,38
next energy australia,google / organic,0,2,0.00%,42
next generation fertility parramatta,google / organic,0,7,0.00%,85
next generation national broadband network,google / organic,0,35,0.00%,73
next new zealand election,google / organic,0,6,0.00%,52
next new zealand general election,google / organic,0,4,0.00%,52
next nz general election,google / organic,0,2,0.00%,28
next state election wa,google / organic,0,2,0.00%,66
next vic state election,google / organic,0,2,0.00%,59
next victorian state election,google / organic,0,3,0.00%,70
next wa election,google / organic,0,1,0.00%,92
next wa state election,google / organic,0,3,0.00%,56
nexus homes,google / organic,0,3,0.00%,59
nft channel for sale australia,google / organic,0,1,0.00%,58
nft meaning event cinema,google / organic,0,2,0.00%,22
nga factors,google / organic,0,1,0.00%,40
nga interview questions,google / organic,0,1,0.00%,60
ngai tahu tourism jobs,google / organic,0,1,0.00%,57
ngaire kerse,google / organic,0,1,0.00%,23
ngaire pronunciation,google / organic,0,1,0.00%,100
ngala sleep training,google / organic,0,1,0.00%,95
ngara,google / organic,0,6,0.00%,71
nge budget,google / organic,0,1,0.00%,49
ngiare brown,google / organic,0,2,0.00%,46
ngiyampaa dictionary,google / organic,0,1,0.00%,86
ngnbn opco,google / organic,0,2,0.00%,48
ngo and sons tutoring,google / organic,0,1,0.00%,54
ngo long,google / organic,0,1,0.00%,10
ngo van long,google / organic,0,2,0.00%,35
ngocha,google / organic,0,3,0.00%,48
ngos mental health,google / organic,0,1,0.00%,71
ngs gang melbourne,google / organic,0,1,0.00%,76
ngu idle wiki,google / organic,0,1,0.00%,64
ngurrala aboriginal corporation,google / organic,0,2,0.00%,49
nhmrc australian dietary guidelines,google / organic,0,2,0.00%,28
nhmrc dietary guidelines,google / organic,0,1,0.00%,38
nht,google / organic,0,1,0.00%,95
nht checklist,google / organic,0,1,0.00%,100
nhvr journey planner,google / organic,0,2,0.00%,93
nhvr journey planner app,google / organic,0,4,0.00%,59
nhvr-037,google / organic,0,2,0.00%,73
nhwds,google / organic,0,1,0.00%,21
nib eyecare,google / organic,0,1,0.00%,60
nic newman reuters,google / organic,0,1,0.00%,98
nic suzor,google / organic,0,10,0.00%,6.5
nicholas aroney,google / organic,0,8,0.00%,23
nicholas cowdery,google / organic,0,1,0.00%,92
nicholas duff,google / organic,0,2,0.00%,9.5
nicholas farrelly,google / organic,0,1,0.00%,88
nicholas gazal,google / organic,0,1,0.00%,34
nicholas graves,google / organic,0,7,0.00%,41
nicholas gruen,google / organic,0,1,0.00%,74
nicholas mcarthur williams senate,google / organic,0,1,0.00%,29
nicholas stern,google / organic,0,1,0.00%,49
nicholas stern report,google / organic,0,1,0.00%,31
nicholas wareham,google / organic,0,1,0.00%,68
nicholls community house,google / organic,0,1,0.00%,80
nick aberle,google / organic,0,2,0.00%,66
nick antoniou hand therapy,google / organic,0,1,0.00%,60
nick aroney,google / organic,0,1,0.00%,64
nick brown farmer wants a wife,google / organic,0,2,0.00%,54
nick brunning,google / organic,0,1,0.00%,76
nick butera,google / organic,0,1,0.00%,72
nick cater,google / organic,0,1,0.00%,64
nick connolly,google / organic,0,3,0.00%,91
nick dowse law notes,google / organic,0,1,0.00%,93
nick duff,google / organic,0,1,0.00%,33
nick evershed,google / organic,0,1,0.00%,82
nick feik,google / organic,0,1,0.00%,35
nick gereffi cause of death 2017,google / organic,0,1,0.00%,37
nick greiner,google / organic,0,1,0.00%,67
nick knowles pharmacy moss vale,google / organic,0,3,0.00%,42
nick lucchinelli,google / organic,0,3,0.00%,18
nick mann,google / organic,0,2,0.00%,87
nick mead values and professional knowledge in teacher education,google / organic,0,1,0.00%,37
nick mead values and professional knowledge in teacher education (epub|lit|mob),google / organic,0,12,0.00%,41
nick mead values and professional knowledge in teacher education download,google / organic,0,3,0.00%,39
nick mead values and professional knowledge in teacher education pdf,google / organic,0,3,0.00%,67
nick mead values and professional knowledge in teacher education torrent,google / organic,0,1,0.00%,68
nick scali dfo south wharf,google / organic,0,1,0.00%,61
nick scali layby,google / organic,0,2,0.00%,33
nick sherry,google / organic,0,1,0.00%,69
nick stolper,google / organic,0,1,0.00%,77
nick weir contract mustering,google / organic,0,1,0.00%,84
nick wyatt,google / organic,0,8,0.00%,60
nick xenophon married,google / organic,0,1,0.00%,65
nicki gamble,google / organic,0,11,0.00%,92
nicki hutley,google / organic,0,1,0.00%,20
nickolas varvaris,google / organic,0,3,0.00%,39
nicky stone,google / organic,0,3,0.00%,34
nicol sadler,google / organic,0,1,0.00%,65
nicola crosta,google / organic,0,9,0.00%,24
nicola fortune,google / organic,0,3,0.00%,9.3
nicola piper,google / organic,0,2,0.00%,98
nicolas malouf investments,google / organic,0,1,0.00%,69
nicole alarcon,google / organic,0,1,0.00%,87
nicole and keller,google / organic,0,5,0.00%,28
nicole bijlsma mould,google / organic,0,2,0.00%,83
nicole buskiewicz,google / organic,0,2,0.00%,67
nicole da silva agent,google / organic,0,1,0.00%,76
nicole da silva gay,google / organic,0,5,0.00%,68
nicole da silva home and away,google / organic,0,27,0.00%,54
nicole da silva is she gay,google / organic,0,1,0.00%,45
